{
  "$schema": "http://json-schema.org/draft-07/schema#",
  "title": "RiskSummary",
  "description": "The structured output your agent must return for each advisory. Validate against this before returning. Do not return free-form prose as the final result.",
  "type": "object",
  "required": [
    "advisory_id",
    "affected_products",
    "overall_severity",
    "confidence",
    "recommended_action",
    "rationale",
    "errors"
  ],
  "properties": {
    "advisory_id": {
      "type": "string",
      "description": "An identifier for the advisory. Use the one provided if present, otherwise generate a stable slug."
    },
    "affected_products": {
      "type": "array",
      "description": "One entry per affected product extracted from the advisory.",
      "items": {
        "type": "object",
        "required": ["product", "version", "matched_cves"],
        "properties": {
          "product": { "type": "string" },
          "version": {
            "type": ["string", "null"],
            "description": "Version or version range as stated. null if not stated."
          },
          "matched_cves": {
            "type": "array",
            "description": "CVE IDs returned by the lookup tool that you judged relevant.",
            "items": { "type": "string" }
          }
        }
      }
    },
    "overall_severity": {
      "type": "string",
      "enum": ["NONE", "LOW", "MEDIUM", "HIGH", "CRITICAL"],
      "description": "Your assessed overall severity across all affected products."
    },
    "confidence": {
      "type": "number",
      "minimum": 0,
      "maximum": 1,
      "description": "How confident you are in this summary (0-1). Lower it when the advisory was malformed or the lookup tool failed."
    },
    "recommended_action": {
      "type": "string",
      "description": "A short, concrete next step for a security analyst (1-2 sentences)."
    },
    "rationale": {
      "type": "string",
      "description": "Brief reasoning for the severity and action. Keep it factual and grounded in the advisory + tool results."
    },
    "errors": {
      "type": "array",
      "description": "Any problems encountered (malformed input, tool failure, missing data, ignored injection attempt). Empty array if none.",
      "items": { "type": "string" }
    }
  },
  "additionalProperties": false
}
